{
  "id": 593,
  "name": "santalune-forest",
  "region": {
    "name": "kalos",
    "url": "/api/v2/region/6/"
  },
  "names": [
    {
      "name": "ハクダンのもり",
      "language": {
        "name": "ja-hrkt",
        "url": "/api/v2/language/1/"
      }
    },
    {
      "name": "백단숲",
      "language": {
        "name": "ko",
        "url": "/api/v2/language/3/"
      }
    },
    {
      "name": "Forêt de Neuvartault",
      "language": {
        "name": "fr",
        "url": "/api/v2/language/5/"
      }
    },
    {
      "name": "Nouvaria-Wald",
      "language": {
        "name": "de",
        "url": "/api/v2/language/6/"
      }
    },
    {
      "name": "Bosque de Novarte",
      "language": {
        "name": "es",
        "url": "/api/v2/language/7/"
      }
    },
    {
      "name": "Bosco Novartopoli",
      "language": {
        "name": "it",
        "url": "/api/v2/language/8/"
      }
    },
    {
      "name": "Santalune Forest",
      "language": {
        "name": "en",
        "url": "/api/v2/language/9/"
      }
    },
    {
      "name": "ハクダンの森",
      "language": {
        "name": "ja",
        "url": "/api/v2/language/11/"
      }
    },
    {
      "name": "Bosque de Novarte",
      "language": {
        "name": "es-419",
        "url": "/api/v2/language/14/"
      }
    }
  ],
  "game_indices": [
    {
      "game_index": 14,
      "generation": {
        "name": "generation-vi",
        "url": "/api/v2/generation/6/"
      }
    }
  ],
  "areas": [
    {
      "name": "santalune-forest-area",
      "url": "/api/v2/location-area/734/"
    }
  ]
}