{
  "id": 1029,
  "name": "tidewater-dam",
  "region": {
    "name": "hisui",
    "url": "/api/v2/region/9/"
  },
  "names": [
    {
      "name": "Digue de l'Estuaire",
      "language": {
        "name": "fr",
        "url": "/api/v2/language/5/"
      }
    },
    {
      "name": "Mündungsdamm",
      "language": {
        "name": "de",
        "url": "/api/v2/language/6/"
      }
    },
    {
      "name": "Tidewater Dam",
      "language": {
        "name": "en",
        "url": "/api/v2/language/9/"
      }
    }
  ],
  "game_indices": [],
  "areas": [
    {
      "name": "tidewater-dam-area",
      "url": "/api/v2/location-area/1023/"
    }
  ]
}