{
    "areas": [],
    "game_indices": [
        {
            "game_index": 103,
            "generation": {
                "name": "generation-vi",
                "url": "http://localhost/api/v2/generation/6/"
            }
        }
    ],
    "id": 656,
    "name": "detourner-way",
    "names": [
        {
            "language": {
                "name": "ja",
                "url": "http://localhost/api/v2/language/11/"
            },
            "name": "\u30c7\u30c8\u30eb\u30cd\u901a\u308a"
        },
        {
            "language": {
                "name": "en",
                "url": "http://localhost/api/v2/language/9/"
            },
            "name": "D\u00e9tourner Way"
        },
        {
            "language": {
                "name": "it",
                "url": "http://localhost/api/v2/language/8/"
            },
            "name": "Via Detour"
        },
        {
            "language": {
                "name": "es",
                "url": "http://localhost/api/v2/language/7/"
            },
            "name": "V\u00eda Desv\u00edo"
        },
        {
            "language": {
                "name": "de",
                "url": "http://localhost/api/v2/language/6/"
            },
            "name": "D\u00e9tourn\u00e9-Weg"
        },
        {
            "language": {
                "name": "fr",
                "url": "http://localhost/api/v2/language/5/"
            },
            "name": "Chemin D\u00e9tour"
        },
        {
            "language": {
                "name": "ko",
                "url": "http://localhost/api/v2/language/3/"
            },
            "name": "\ub370\ub69c\ub974\ub124 \ub3c4\ub85c"
        },
        {
            "language": {
                "name": "ja-Hrkt",
                "url": "http://localhost/api/v2/language/1/"
            },
            "name": "\u30c7\u30c8\u30eb\u30cd\u3069\u304a\u308a"
        }
    ],
    "region": {
        "name": "kalos",
        "url": "http://localhost/api/v2/region/6/"
    }
}
