{
    "areas": [
        {
            "name": "sinnoh-route-228-area",
            "url": "http://localhost/api/v2/location-area/175/"
        }
    ],
    "game_indices": [
        {
            "game_index": 43,
            "generation": {
                "name": "generation-iv",
                "url": "http://localhost/api/v2/generation/4/"
            }
        }
    ],
    "id": 56,
    "name": "sinnoh-route-228",
    "names": [
        {
            "language": {
                "name": "en",
                "url": "http://localhost/api/v2/language/9/"
            },
            "name": "Route 228"
        },
        {
            "language": {
                "name": "fr",
                "url": "http://localhost/api/v2/language/5/"
            },
            "name": "Route 228"
        }
    ],
    "region": {
        "name": "sinnoh",
        "url": "http://localhost/api/v2/region/4/"
    }
}
