{
  "id": 47,
  "name": "sinnoh-route-216",
  "region": {
    "name": "sinnoh",
    "url": "/api/v2/region/4/"
  },
  "names": [
    {
      "name": "Route 216",
      "language": {
        "name": "fr",
        "url": "/api/v2/language/5/"
      }
    },
    {
      "name": "Route 216",
      "language": {
        "name": "de",
        "url": "/api/v2/language/6/"
      }
    },
    {
      "name": "Route 216",
      "language": {
        "name": "en",
        "url": "/api/v2/language/9/"
      }
    }
  ],
  "game_indices": [
    {
      "game_index": 31,
      "generation": {
        "name": "generation-iv",
        "url": "/api/v2/generation/4/"
      }
    }
  ],
  "areas": [
    {
      "name": "sinnoh-route-216-area",
      "url": "/api/v2/location-area/166/"
    }
  ]
}