{
  "id": 627,
  "name": "fourrage-road",
  "region": {
    "name": "kalos",
    "url": "/api/v2/region/6/"
  },
  "names": [
    {
      "name": "フラージュどおり",
      "language": {
        "name": "ja-hrkt",
        "url": "/api/v2/language/1/"
      }
    },
    {
      "name": "프라주 도로",
      "language": {
        "name": "ko",
        "url": "/api/v2/language/3/"
      }
    },
    {
      "name": "Chemin Fourrage",
      "language": {
        "name": "fr",
        "url": "/api/v2/language/5/"
      }
    },
    {
      "name": "Fourrage-Weg",
      "language": {
        "name": "de",
        "url": "/api/v2/language/6/"
      }
    },
    {
      "name": "Vereda del Heno",
      "language": {
        "name": "es",
        "url": "/api/v2/language/7/"
      }
    },
    {
      "name": "Via dei Pascoli",
      "language": {
        "name": "it",
        "url": "/api/v2/language/8/"
      }
    },
    {
      "name": "Fourrage Road",
      "language": {
        "name": "en",
        "url": "/api/v2/language/9/"
      }
    },
    {
      "name": "フラージュ通り",
      "language": {
        "name": "ja",
        "url": "/api/v2/language/11/"
      }
    },
    {
      "name": "Vereda del Heno",
      "language": {
        "name": "es-419",
        "url": "/api/v2/language/14/"
      }
    }
  ],
  "game_indices": [
    {
      "game_index": 63,
      "generation": {
        "name": "generation-vi",
        "url": "/api/v2/generation/6/"
      }
    }
  ],
  "areas": []
}