{
  "id": 1121,
  "name": "kalos-berry-fields",
  "region": {
    "name": "kalos",
    "url": "/api/v2/region/6/"
  },
  "names": [
    {
      "name": "Kalos Berry Fields",
      "language": {
        "name": "de",
        "url": "/api/v2/language/6/"
      }
    }
  ],
  "game_indices": [],
  "areas": [
    {
      "name": "kalos-berry-fields-area",
      "url": "/api/v2/location-area/1483/"
    }
  ]
}