{
  "id": 714,
  "name": "kalae-bay",
  "region": {
    "name": "alola",
    "url": "/api/v2/region/7/"
  },
  "names": [
    {
      "name": "カーラエわん",
      "language": {
        "name": "ja-hrkt",
        "url": "/api/v2/language/1/"
      }
    },
    {
      "name": "칼라에만",
      "language": {
        "name": "ko",
        "url": "/api/v2/language/3/"
      }
    },
    {
      "name": "卡拉蔚灣",
      "language": {
        "name": "zh-hant",
        "url": "/api/v2/language/4/"
      }
    },
    {
      "name": "Baie de Kala’e",
      "language": {
        "name": "fr",
        "url": "/api/v2/language/5/"
      }
    },
    {
      "name": "Kala’e-Bucht",
      "language": {
        "name": "de",
        "url": "/api/v2/language/6/"
      }
    },
    {
      "name": "Bahía Kalae",
      "language": {
        "name": "es",
        "url": "/api/v2/language/7/"
      }
    },
    {
      "name": "Baia Kala’e",
      "language": {
        "name": "it",
        "url": "/api/v2/language/8/"
      }
    },
    {
      "name": "Kala’e Bay",
      "language": {
        "name": "en",
        "url": "/api/v2/language/9/"
      }
    },
    {
      "name": "カーラエ湾",
      "language": {
        "name": "ja",
        "url": "/api/v2/language/11/"
      }
    },
    {
      "name": "卡拉蔚湾",
      "language": {
        "name": "zh-hans",
        "url": "/api/v2/language/12/"
      }
    },
    {
      "name": "Bahía Kalae",
      "language": {
        "name": "es-419",
        "url": "/api/v2/language/14/"
      }
    }
  ],
  "game_indices": [
    {
      "game_index": 14,
      "generation": {
        "name": "generation-vii",
        "url": "/api/v2/generation/7/"
      }
    }
  ],
  "areas": [
    {
      "name": "kalae-bay-area",
      "url": "/api/v2/location-area/1090/"
    }
  ]
}