{
  "id": 89,
  "name": "kanto-route-10",
  "region": {
    "name": "kanto",
    "url": "/api/v2/region/1/"
  },
  "names": [
    {
      "name": "Route 10",
      "language": {
        "name": "fr",
        "url": "/api/v2/language/5/"
      }
    },
    {
      "name": "Route 10",
      "language": {
        "name": "de",
        "url": "/api/v2/language/6/"
      }
    },
    {
      "name": "Route 10",
      "language": {
        "name": "en",
        "url": "/api/v2/language/9/"
      }
    }
  ],
  "game_indices": [
    {
      "game_index": 21,
      "generation": {
        "name": "generation-i",
        "url": "/api/v2/generation/1/"
      }
    },
    {
      "game_index": 67,
      "generation": {
        "name": "generation-ii",
        "url": "/api/v2/generation/2/"
      }
    },
    {
      "game_index": 110,
      "generation": {
        "name": "generation-iii",
        "url": "/api/v2/generation/3/"
      }
    },
    {
      "game_index": 158,
      "generation": {
        "name": "generation-iv",
        "url": "/api/v2/generation/4/"
      }
    }
  ],
  "areas": [
    {
      "name": "kanto-route-10-area",
      "url": "/api/v2/location-area/304/"
    }
  ]
}