{
  "id": 613,
  "name": "muraille-coast",
  "region": {
    "name": "kalos",
    "url": "/api/v2/region/6/"
  },
  "names": [
    {
      "name": "ミュライユかいがん",
      "language": {
        "name": "ja-hrkt",
        "url": "/api/v2/language/1/"
      }
    },
    {
      "name": "미라유 해안",
      "language": {
        "name": "ko",
        "url": "/api/v2/language/3/"
      }
    },
    {
      "name": "Falaise Muraille",
      "language": {
        "name": "fr",
        "url": "/api/v2/language/5/"
      }
    },
    {
      "name": "Muraille-Küstenpfad",
      "language": {
        "name": "de",
        "url": "/api/v2/language/6/"
      }
    },
    {
      "name": "Muralla Costera",
      "language": {
        "name": "es",
        "url": "/api/v2/language/7/"
      }
    },
    {
      "name": "Muraglia Costiera",
      "language": {
        "name": "it",
        "url": "/api/v2/language/8/"
      }
    },
    {
      "name": "Muraille Coast",
      "language": {
        "name": "en",
        "url": "/api/v2/language/9/"
      }
    },
    {
      "name": "ミュライユ海岸",
      "language": {
        "name": "ja",
        "url": "/api/v2/language/11/"
      }
    },
    {
      "name": "Muralla Costera",
      "language": {
        "name": "es-419",
        "url": "/api/v2/language/14/"
      }
    }
  ],
  "game_indices": [
    {
      "game_index": 43,
      "generation": {
        "name": "generation-vi",
        "url": "/api/v2/generation/6/"
      }
    }
  ],
  "areas": []
}