{
  "id": 469,
  "name": "hoenn-route-121",
  "region": {
    "name": "hoenn",
    "url": "/api/v2/region/3/"
  },
  "names": [
    {
      "name": "１２１ばんどうろ",
      "language": {
        "name": "ja-hrkt",
        "url": "/api/v2/language/1/"
      }
    },
    {
      "name": "121번도로",
      "language": {
        "name": "ko",
        "url": "/api/v2/language/3/"
      }
    },
    {
      "name": "Route 121",
      "language": {
        "name": "fr",
        "url": "/api/v2/language/5/"
      }
    },
    {
      "name": "Route 121",
      "language": {
        "name": "de",
        "url": "/api/v2/language/6/"
      }
    },
    {
      "name": "Ruta 121",
      "language": {
        "name": "es",
        "url": "/api/v2/language/7/"
      }
    },
    {
      "name": "Percorso 121",
      "language": {
        "name": "it",
        "url": "/api/v2/language/8/"
      }
    },
    {
      "name": "Route 121",
      "language": {
        "name": "en",
        "url": "/api/v2/language/9/"
      }
    },
    {
      "name": "１２１番道路",
      "language": {
        "name": "ja",
        "url": "/api/v2/language/11/"
      }
    },
    {
      "name": "Ruta 121",
      "language": {
        "name": "es-419",
        "url": "/api/v2/language/14/"
      }
    }
  ],
  "game_indices": [
    {
      "game_index": 36,
      "generation": {
        "name": "generation-iii",
        "url": "/api/v2/generation/3/"
      }
    },
    {
      "game_index": 244,
      "generation": {
        "name": "generation-vi",
        "url": "/api/v2/generation/6/"
      }
    }
  ],
  "areas": [
    {
      "name": "hoenn-route-121-area",
      "url": "/api/v2/location-area/413/"
    }
  ]
}