{
  "id": 517,
  "name": "ruin-valley",
  "region": {
    "name": "kanto",
    "url": "/api/v2/region/1/"
  },
  "names": [
    {
      "name": "Vallée Ruine",
      "language": {
        "name": "fr",
        "url": "/api/v2/language/5/"
      }
    },
    {
      "name": "Ruinental",
      "language": {
        "name": "de",
        "url": "/api/v2/language/6/"
      }
    },
    {
      "name": "Ruin Valley",
      "language": {
        "name": "en",
        "url": "/api/v2/language/9/"
      }
    }
  ],
  "game_indices": [
    {
      "game_index": 166,
      "generation": {
        "name": "generation-iii",
        "url": "/api/v2/generation/3/"
      }
    }
  ],
  "areas": [
    {
      "name": "ruin-valley-area",
      "url": "/api/v2/location-area/524/"
    }
  ]
}