{
  "id": 954,
  "name": "arenas-approach",
  "region": {
    "name": "hisui",
    "url": "/api/v2/region/9/"
  },
  "names": [
    {
      "name": "Sentier de l'Arène",
      "language": {
        "name": "fr",
        "url": "/api/v2/language/5/"
      }
    },
    {
      "name": "Pfad zum Kampffeld",
      "language": {
        "name": "de",
        "url": "/api/v2/language/6/"
      }
    },
    {
      "name": "Arena's Approach",
      "language": {
        "name": "en",
        "url": "/api/v2/language/9/"
      }
    }
  ],
  "game_indices": [],
  "areas": [
    {
      "name": "arenas-approach-area",
      "url": "/api/v2/location-area/948/"
    }
  ]
}