{
  "id": 818,
  "name": "cortondo",
  "region": {
    "name": "paldea",
    "url": "/api/v2/region/10/"
  },
  "names": [
    {
      "name": "Sevaro",
      "language": {
        "name": "fr",
        "url": "/api/v2/language/5/"
      }
    },
    {
      "name": "Moldrid",
      "language": {
        "name": "de",
        "url": "/api/v2/language/6/"
      }
    },
    {
      "name": "Cortondo",
      "language": {
        "name": "en",
        "url": "/api/v2/language/9/"
      }
    }
  ],
  "game_indices": [
    {
      "game_index": 84,
      "generation": {
        "name": "generation-ix",
        "url": "/api/v2/generation/9/"
      }
    }
  ],
  "areas": []
}