{
  "id": 253,
  "name": "day-care-couple",
  "region": null,
  "names": [
    {
      "name": "Couple Pension",
      "language": {
        "name": "fr",
        "url": "/api/v2/language/5/"
      }
    },
    {
      "name": "Pensions-Paar",
      "language": {
        "name": "de",
        "url": "/api/v2/language/6/"
      }
    },
    {
      "name": "Day-Care Couple",
      "language": {
        "name": "en",
        "url": "/api/v2/language/9/"
      }
    }
  ],
  "game_indices": [
    {
      "game_index": 2000,
      "generation": {
        "name": "generation-iv",
        "url": "/api/v2/generation/4/"
      }
    },
    {
      "game_index": 60002,
      "generation": {
        "name": "generation-v",
        "url": "/api/v2/generation/5/"
      }
    },
    {
      "game_index": 60002,
      "generation": {
        "name": "generation-vi",
        "url": "/api/v2/generation/6/"
      }
    }
  ],
  "areas": []
}