{
  "id": 314,
  "name": "pokepark-14",
  "region": null,
  "names": [
    {
      "name": "POKéPARK 14",
      "language": {
        "name": "fr",
        "url": "/api/v2/language/5/"
      }
    },
    {
      "name": "",
      "language": {
        "name": "de",
        "url": "/api/v2/language/6/"
      }
    },
    {
      "name": "POKéPARK 14",
      "language": {
        "name": "en",
        "url": "/api/v2/language/9/"
      }
    }
  ],
  "game_indices": [
    {
      "game_index": 3049,
      "generation": {
        "name": "generation-iv",
        "url": "/api/v2/generation/4/"
      }
    },
    {
      "game_index": 40102,
      "generation": {
        "name": "generation-v",
        "url": "/api/v2/generation/5/"
      }
    }
  ],
  "areas": []
}