{
  "id": 184,
  "name": "sinnoh-battle-tower",
  "region": {
    "name": "sinnoh",
    "url": "/api/v2/region/4/"
  },
  "names": [
    {
      "name": "Tour de Combat",
      "language": {
        "name": "fr",
        "url": "/api/v2/language/5/"
      }
    },
    {
      "name": "Duellturm",
      "language": {
        "name": "de",
        "url": "/api/v2/language/6/"
      }
    },
    {
      "name": "Battle Tower",
      "language": {
        "name": "en",
        "url": "/api/v2/language/9/"
      }
    }
  ],
  "game_indices": [
    {
      "game_index": 80,
      "generation": {
        "name": "generation-iv",
        "url": "/api/v2/generation/4/"
      }
    }
  ],
  "areas": []
}