{
  "id": 1066,
  "name": "kitakami-wilds",
  "region": {
    "name": "paldea",
    "url": "/api/v2/region/10/"
  },
  "names": [
    {
      "name": "Terres Vierges de Septentria",
      "language": {
        "name": "fr",
        "url": "/api/v2/language/5/"
      }
    },
    {
      "name": "Wildnis von Kitakami",
      "language": {
        "name": "de",
        "url": "/api/v2/language/6/"
      }
    },
    {
      "name": "Kitakami Wilds",
      "language": {
        "name": "en",
        "url": "/api/v2/language/9/"
      }
    }
  ],
  "game_indices": [
    {
      "game_index": 164,
      "generation": {
        "name": "generation-ix",
        "url": "/api/v2/generation/9/"
      }
    }
  ],
  "areas": []
}